{
  "$schema": "../../../schemas/component-contract.schema.json",
  "schemaVersion": "0.1.0",
  "id": "code-diff",
  "name": "Code Diff",
  "status": "draft",
  "category": "ai & developer",
  "description": "変更差分の表示。追加・削除・変更行を色+記号で示す。",
  "source": {
    "humanDoc": "components/code-diff.md",
    "registry": "js/components-registry.js#code-diff"
  },
  "intent": {
    "whenToUse": [
      "変更前後のcodeを行単位でreviewするとき。"
    ],
    "whenNotToUse": [
      "完成したcodeの参照にはCode Blockを使う。"
    ],
    "principles": [
      1,
      2,
      3,
      5,
      6
    ]
  },
  "anatomy": [
    {
      "part": "root",
      "required": true,
      "description": "Collection container with an explicit reading order."
    },
    {
      "part": "item",
      "required": true,
      "description": "Repeated row, event, node, message, or entry."
    },
    {
      "part": "primary-content",
      "required": true,
      "description": "Main scannable value."
    },
    {
      "part": "metadata",
      "required": false,
      "description": "Secondary state, time, owner, or count."
    },
    {
      "part": "actions",
      "required": false,
      "description": "Item-level operations with independent names."
    }
  ],
  "variants": {
    "default": {
      "intent": "標準文脈。",
      "tokenRefs": {},
      "states": {}
    }
  },
  "sizes": {},
  "states": [
    {
      "id": "default",
      "description": "通常状態。意味、label、valueを省略しない。",
      "requiredBehavior": [
        "通常状態。意味、label、valueを省略しない。"
      ]
    }
  ],
  "props": [
    {
      "name": "children",
      "type": "ReactNode",
      "required": true,
      "default": null,
      "description": "Componentの主要content。"
    }
  ],
  "tokenRefs": {
    "semanticColor": [
      "--surface",
      "--border",
      "--fg",
      "--surface-muted",
      "--fg-muted",
      "--border-muted",
      "--table-row-hover",
      "--focus-ring"
    ],
    "density": [
      "--row-h",
      "--cell-y"
    ]
  },
  "tokenBindings": {
    "coverage": "partial",
    "bindings": [
      {
        "slot": "token.surface.value",
        "source": "--surface",
        "scope": "semantic",
        "componentToken": null,
        "aliases": null,
        "trigger": null,
        "reason": "Code Diffの公開visual contractで用途tokenとして共有する。"
      },
      {
        "slot": "token.border.value",
        "source": "--border",
        "scope": "semantic",
        "componentToken": null,
        "aliases": null,
        "trigger": null,
        "reason": "Code Diffの公開visual contractで用途tokenとして共有する。"
      },
      {
        "slot": "token.fg.value",
        "source": "--fg",
        "scope": "semantic",
        "componentToken": null,
        "aliases": null,
        "trigger": null,
        "reason": "Code Diffの公開visual contractで用途tokenとして共有する。"
      },
      {
        "slot": "token.surface-muted.value",
        "source": "--surface-muted",
        "scope": "semantic",
        "componentToken": null,
        "aliases": null,
        "trigger": null,
        "reason": "Code Diffの公開visual contractで用途tokenとして共有する。"
      },
      {
        "slot": "token.fg-muted.value",
        "source": "--fg-muted",
        "scope": "semantic",
        "componentToken": null,
        "aliases": null,
        "trigger": null,
        "reason": "Code Diffの公開visual contractで用途tokenとして共有する。"
      },
      {
        "slot": "token.border-muted.value",
        "source": "--border-muted",
        "scope": "semantic",
        "componentToken": null,
        "aliases": null,
        "trigger": null,
        "reason": "Code Diffの公開visual contractで用途tokenとして共有する。"
      },
      {
        "slot": "token.table-row-hover.value",
        "source": "--table-row-hover",
        "scope": "component",
        "componentToken": "--table-row-hover",
        "aliases": null,
        "trigger": "intrinsic-component-value",
        "reason": "大量行で反復するTable hoverはsurface tokenより弱い固有濃度を必要とする。"
      },
      {
        "slot": "token.row-h.value",
        "source": "--row-h",
        "scope": "semantic",
        "componentToken": null,
        "aliases": null,
        "trigger": null,
        "reason": "Code Diffの公開visual contractで用途tokenとして共有する。"
      },
      {
        "slot": "token.cell-y.value",
        "source": "--cell-y",
        "scope": "semantic",
        "componentToken": null,
        "aliases": null,
        "trigger": null,
        "reason": "Code Diffの公開visual contractで用途tokenとして共有する。"
      },
      {
        "slot": "token.focus-ring.value",
        "source": "--focus-ring",
        "scope": "semantic",
        "componentToken": null,
        "aliases": null,
        "trigger": null,
        "reason": "Code Diffの公開visual contractで用途tokenとして共有する。"
      }
    ],
    "unboundSlots": [
      {
        "slot": "implementation.visual-state-audit",
        "reason": "React package実装時にDOM、state selector、全visual slotの最終bindingを照合する。",
        "owner": "components.code-diff"
      }
    ]
  },
  "accessibility": {
    "requirements": [
      "表示専用rootを不要にtab順へ追加しない。",
      "状態は色だけで表さずtext、icon、shapeを併用する。"
    ],
    "aria": [
      "Native semanticsを優先し、ARIAは不足する関係と状態だけを補う。"
    ],
    "focus": [
      "Nested controlがある場合だけ、そのcontrolがfocusを受け取る。"
    ]
  },
  "keyboardInteractions": [],
  "usagePatterns": [
    {
      "id": "recommended-1",
      "title": "Primary context",
      "description": "変更前後のcodeを行単位でreviewするとき。",
      "recommended": [
        "+/− 記号を必ず併記し、色のみに依存しない。"
      ],
      "avoid": [
        "完成したcodeの参照にはCode Blockを使う。"
      ]
    }
  ],
  "responsiveBehavior": {
    "desktop": {
      "summary": "DesktopでのCode Diff。",
      "rules": [
        "列・項目の比較可能性を保ち、必要な幅を確保する。",
        "Keyboard focusと選択状態をscroll位置から失わない。"
      ],
      "avoid": [
        "Hoverだけで状態や操作を伝えない。"
      ]
    },
    "mobile": {
      "summary": "MobileでのCode Diff。",
      "rules": [
        "意味のある列や項目を潰さず、横scroll、優先列、detail viewのいずれかを明示的に選ぶ。",
        "Scroll領域の外にも現在位置や操作の手掛かりを残す。"
      ],
      "avoid": [
        "PC用とSP用に意味やAPIの異なるcomponentを複製しない。"
      ]
    },
    "touch": {
      "summary": "Touch入力でのCode Diff。",
      "rules": [
        "表示専用rootをtab順へ追加しない。",
        "内包する操作がある場合だけ、その操作targetを24px minimum、主要touch操作を原則44px以上にする。"
      ],
      "avoid": [
        "小さな隣接targetやgestureだけの操作を作らない。"
      ]
    }
  },
  "rules": [
    "NO_RAW_HEX_COLOR",
    "SPACING_FROM_TOKENS_ONLY",
    "RADIUS_FROM_TOKENS_ONLY",
    "CONTRAST_AA_MINIMUM"
  ],
  "qualityChecks": [
    "When to use / not useの境界が明確",
    "PC / SP / touchで同じsemantic contractを維持",
    "公開tokenだけを参照",
    "Keyboardとaccessible nameを検証",
    "Light / Dark × Standard / Highと3 densityで確認"
  ],
  "examples": [
    {
      "id": "default",
      "description": "Code Diffの標準例。",
      "code": "<CodeDiff\n  file=\"src/lib/sort.ts\"\n  hunks={hunks}\n  collapsible\n  onComment={addComment}\n/>"
    }
  ],
  "openQuestions": [
    "React package実装時にDOM/ref/event APIと全visual slot bindingを確定し、coverage completeでstableへ移行する。"
  ]
}
