{
  "$schema": "../../../schemas/component-contract.schema.json",
  "schemaVersion": "0.1.0",
  "id": "radio",
  "name": "Radio",
  "status": "draft",
  "category": "forms",
  "description": "排他的な選択肢から 1 つを選ぶ。すべての選択肢を見せたい場合に使う。",
  "source": {
    "humanDoc": "components/radio.md",
    "registry": "js/components-registry.js#radio"
  },
  "intent": {
    "whenToUse": [
      "2〜4 個の排他選択で、比較して選ばせたい場合"
    ],
    "whenNotToUse": [
      "選択肢が多い → Select",
      "ON/OFF → Switch / Checkbox"
    ],
    "principles": [
      1,
      2,
      3,
      5,
      6
    ]
  },
  "anatomy": [
    {
      "part": "root",
      "required": true,
      "description": "Selection control boundary."
    },
    {
      "part": "value",
      "required": true,
      "description": "Current value or selected option."
    },
    {
      "part": "indicator",
      "required": true,
      "description": "Selection, thumb, check, or disclosure indicator."
    },
    {
      "part": "popup",
      "required": false,
      "description": "Option list or calendar when the pattern opens one."
    }
  ],
  "variants": {
    "default": {
      "intent": "標準文脈。",
      "tokenRefs": {},
      "states": {}
    }
  },
  "sizes": {},
  "states": [
    {
      "id": "default",
      "description": "通常状態。意味、label、valueを省略しない。",
      "requiredBehavior": [
        "通常状態。意味、label、valueを省略しない。"
      ]
    },
    {
      "id": "disabled",
      "description": "操作不能である理由を周辺文脈から理解できるようにする。",
      "requiredBehavior": [
        "操作不能である理由を周辺文脈から理解できるようにする。"
      ]
    }
  ],
  "props": [
    {
      "name": "value",
      "type": "unknown",
      "required": false,
      "default": null,
      "description": "Controlled value。"
    },
    {
      "name": "onChange",
      "type": "(value) => void",
      "required": false,
      "default": null,
      "description": "User操作で値が変わるときに通知する。"
    },
    {
      "name": "disabled",
      "type": "boolean",
      "required": false,
      "default": "false",
      "description": "操作不能state。"
    }
  ],
  "tokenRefs": {
    "semanticColor": [
      "--surface",
      "--border",
      "--fg",
      "--surface-muted",
      "--fg-muted",
      "--border-strong",
      "--primary",
      "--primary-subtle",
      "--focus-ring"
    ],
    "density": [
      "--ctl-md"
    ],
    "spacing": [
      "--sp-2"
    ],
    "radius": [
      "--radius-sm"
    ],
    "motion": [
      "--dur-fast"
    ]
  },
  "tokenBindings": {
    "coverage": "partial",
    "bindings": [
      {
        "slot": "token.surface.value",
        "source": "--surface",
        "scope": "semantic",
        "componentToken": null,
        "aliases": null,
        "trigger": null,
        "reason": "Radioの公開visual contractで用途tokenとして共有する。"
      },
      {
        "slot": "token.border.value",
        "source": "--border",
        "scope": "semantic",
        "componentToken": null,
        "aliases": null,
        "trigger": null,
        "reason": "Radioの公開visual contractで用途tokenとして共有する。"
      },
      {
        "slot": "token.fg.value",
        "source": "--fg",
        "scope": "semantic",
        "componentToken": null,
        "aliases": null,
        "trigger": null,
        "reason": "Radioの公開visual contractで用途tokenとして共有する。"
      },
      {
        "slot": "token.surface-muted.value",
        "source": "--surface-muted",
        "scope": "semantic",
        "componentToken": null,
        "aliases": null,
        "trigger": null,
        "reason": "Radioの公開visual contractで用途tokenとして共有する。"
      },
      {
        "slot": "token.fg-muted.value",
        "source": "--fg-muted",
        "scope": "semantic",
        "componentToken": null,
        "aliases": null,
        "trigger": null,
        "reason": "Radioの公開visual contractで用途tokenとして共有する。"
      },
      {
        "slot": "token.border-strong.value",
        "source": "--border-strong",
        "scope": "semantic",
        "componentToken": null,
        "aliases": null,
        "trigger": null,
        "reason": "Radioの公開visual contractで用途tokenとして共有する。"
      },
      {
        "slot": "token.primary.value",
        "source": "--primary",
        "scope": "semantic",
        "componentToken": null,
        "aliases": null,
        "trigger": null,
        "reason": "Radioの公開visual contractで用途tokenとして共有する。"
      },
      {
        "slot": "token.primary-subtle.value",
        "source": "--primary-subtle",
        "scope": "semantic",
        "componentToken": null,
        "aliases": null,
        "trigger": null,
        "reason": "Radioの公開visual contractで用途tokenとして共有する。"
      },
      {
        "slot": "token.focus-ring.value",
        "source": "--focus-ring",
        "scope": "semantic",
        "componentToken": null,
        "aliases": null,
        "trigger": null,
        "reason": "Radioの公開visual contractで用途tokenとして共有する。"
      },
      {
        "slot": "token.ctl-md.value",
        "source": "--ctl-md",
        "scope": "semantic",
        "componentToken": null,
        "aliases": null,
        "trigger": null,
        "reason": "Radioの公開visual contractで用途tokenとして共有する。"
      },
      {
        "slot": "token.sp-2.value",
        "source": "--sp-2",
        "scope": "semantic",
        "componentToken": null,
        "aliases": null,
        "trigger": null,
        "reason": "Radioの公開visual contractで用途tokenとして共有する。"
      },
      {
        "slot": "token.radius-sm.value",
        "source": "--radius-sm",
        "scope": "semantic",
        "componentToken": null,
        "aliases": null,
        "trigger": null,
        "reason": "Radioの公開visual contractで用途tokenとして共有する。"
      },
      {
        "slot": "token.dur-fast.value",
        "source": "--dur-fast",
        "scope": "semantic",
        "componentToken": null,
        "aliases": null,
        "trigger": null,
        "reason": "Radioの公開visual contractで用途tokenとして共有する。"
      }
    ],
    "unboundSlots": [
      {
        "slot": "implementation.visual-state-audit",
        "reason": "React package実装時にDOM、state selector、全visual slotの最終bindingを照合する。",
        "owner": "components.radio"
      }
    ]
  },
  "accessibility": {
    "requirements": [
      "Keyboardとpointerで同じ機能を実行できる。",
      "Focus indicatorを常に視認でき、sticky layerで完全に隠さない。",
      "Targetは24px minimumを満たし、主要touch操作は原則44px以上にする。"
    ],
    "aria": [
      "Native radio groupまたはradiogroup semanticsを使う。"
    ],
    "focus": [
      "focus-visibleで--focus-ringを使う。",
      "Positive tabindexを使わず、DOMとvisualの順序を一致させる。"
    ]
  },
  "keyboardInteractions": [
    {
      "key": "Arrow keys",
      "action": "Radio group内の選択を移動する。"
    },
    {
      "key": "Space",
      "action": "Focused optionを選択する。"
    }
  ],
  "usagePatterns": [
    {
      "id": "recommended-1",
      "title": "Primary context",
      "description": "2〜4 個の排他選択で、比較して選ばせたい場合",
      "recommended": [
        "デフォルト選択を必ず用意する。"
      ],
      "avoid": [
        "選択肢が多い → Select"
      ]
    }
  ],
  "responsiveBehavior": {
    "desktop": {
      "summary": "DesktopでのRadio。",
      "rules": [
        "周辺layoutに応じたintrinsic widthを基本にし、formではlabelとの整列を保つ。",
        "Keyboard focusとhoverを別々に確認する。"
      ],
      "avoid": [
        "Hoverだけで状態や操作を伝えない。"
      ]
    },
    "mobile": {
      "summary": "MobileでのRadio。",
      "rules": [
        "Form文脈では利用可能幅まで広げ、複数controlを無理に横へ詰めない。",
        "同じpropとstate contractを維持する。"
      ],
      "avoid": [
        "PC用とSP用に意味やAPIの異なるcomponentを複製しない。"
      ]
    },
    "touch": {
      "summary": "Touch入力でのRadio。",
      "rules": [
        "Pointer targetは24px minimumを満たし、touch中心の主要操作は原則44px以上にする。",
        "Hoverだけに情報や操作を依存させず、連打とdragには同等の非gesture操作を用意する。"
      ],
      "avoid": [
        "小さな隣接targetやgestureだけの操作を作らない。"
      ]
    }
  },
  "rules": [
    "NO_RAW_HEX_COLOR",
    "SPACING_FROM_TOKENS_ONLY",
    "RADIUS_FROM_TOKENS_ONLY",
    "CONTRAST_AA_MINIMUM",
    "FOCUS_VISIBLE_REQUIRED",
    "NO_POSITIVE_TABINDEX",
    "TARGET_SIZE_MINIMUM",
    "INTERACTIVE_NAME_REQUIRED"
  ],
  "qualityChecks": [
    "When to use / not useの境界が明確",
    "PC / SP / touchで同じsemantic contractを維持",
    "公開tokenだけを参照",
    "Keyboardとaccessible nameを検証",
    "Light / Dark × Standard / Highと3 densityで確認"
  ],
  "examples": [
    {
      "id": "default",
      "description": "Radioの標準例。",
      "code": "<RadioGroup label=\"公開範囲\" defaultValue=\"public\">\n  <Radio value=\"public\" label=\"Public\" />\n  <Radio value=\"private\" label=\"Private\" />\n</RadioGroup>"
    }
  ],
  "openQuestions": [
    "React package実装時にDOM/ref/event APIと全visual slot bindingを確定し、coverage completeでstableへ移行する。"
  ]
}
